{
  "visible": true,
  "name": "Osteopenia",
  "uri": "osteopenia",
  "carnivoreDietSearchQueries": [
    "Osteopenia"
  ],
  "filteredAnecdotes": [],
  "anecdotes": [
    {
      "visible": true,
      "uri": "https://carnivore.diet/mimi-improved-rheumatoid-arthritis-parkinsons-disease-and-osteopenia-on-the-carnivore-diet/",
      "title": "Mimi improved rheumatoid arthritis, Parkinson&#039;s disease, and osteopenia on the carnivore diet",
      "date": "March 7, 2024"
    },
    {
      "visible": true,
      "uri": "https://carnivore.diet/nanci-heals-osteopenia-carnivore-diet/",
      "title": "Nanci heals from osteopenia on the carnivore diet",
      "date": "July 20, 2022"
    },
    {
      "visible": true,
      "uri": "https://carnivore.diet/cindy-gets-off-blood-pressure-medication-on-carnivore-diet/",
      "title": "Cindy Gets Off Blood Pressure Medication With the Carnivore Diet",
      "date": "May 6, 2022"
    },
    {
      "visible": true,
      "uri": "https://carnivore.diet/stephen-improved-cancer-diagnosis-carnivore-diet/",
      "title": "Stephen improved his cancer diagnosis with a carnivore diet.",
      "date": "November 1, 2018"
    }
  ],
  "definition": {
    "source": "https://my.clevelandclinic.org/health/diseases/21855-osteopenia",
    "text": "Osteopenia is a loss of bone density. Having reduced bone density means your bones don\u2019t have as much mineral content as they should. This can make them weaker and increase your risk of bone fractures (broken bones). If you have osteopenia, your bone density is lower than average. It can progress to osteoporosis."
  },
  "papers": [],
  "articles": [],
  "videos": []
}
