{
  "visible": true,
  "name": "Osteoporosis",
  "uri": "osteoporosis",
  "carnivoreDietSearchQueries": [
    "Osteoporosis"
  ],
  "filteredAnecdotes": [],
  "anecdotes": [
    {
      "visible": true,
      "uri": "https://carnivore.diet/daniel-heals-from-type-2-diabetes-osteoporosis-and-cardiovascular-disease-on-a-carnivore-diet/",
      "title": "Daniel heals from type 2 diabetes, osteoporosis, and cardiovascular disease on a carnivore diet",
      "date": "June 27, 2024"
    },
    {
      "visible": true,
      "uri": "https://carnivore.diet/claire-reverses-osteoporosis-puts-on-muscle-carnivore/",
      "title": "Claire Reverses Osteoporosis and Puts On Muscle In Her 60s On A Carnivore Diet",
      "date": "August 21, 2022"
    },
    {
      "visible": true,
      "uri": "https://carnivore.diet/maria-healed-eating-disorder-gastroparesis-osteoporosis-and-arthritis-on-carnivore-diet/",
      "title": "Maria healed eating disorder, gastroparesis, osteoporosis, and arthritis on carnivore diet",
      "date": "October 22, 2021"
    },
    {
      "visible": true,
      "uri": "https://carnivore.diet/jake-improves-athletic-performance-and-mental-clarity-carnivore-diet/",
      "title": "Jake improves athletic performance and mental clarity on a carnivore diet",
      "date": "May 31, 2024"
    },
    {
      "visible": true,
      "uri": "https://carnivore.diet/valerie-heals-from-schizoaffective-disorder-and-anorexia-on-a-carnivore-diet/",
      "title": "Valerie heals from schizoaffective disorder and anorexia on a carnivore diet",
      "date": "March 26, 2024"
    },
    {
      "visible": true,
      "uri": "https://carnivore.diet/donna-manages-graves-disease-and-osteporosis-on-a-carnivore-diet/",
      "title": "Donna manages Graves\u2019 disease and osteporosis on a carnivore diet",
      "date": "July 13, 2023"
    },
    {
      "visible": true,
      "uri": "https://carnivore.diet/cindy-gets-off-blood-pressure-medication-on-carnivore-diet/",
      "title": "Cindy gets off blood pressure medication on carnivore diet",
      "date": "May 6, 2022"
    },
    {
      "visible": true,
      "uri": "https://carnivore.diet/rebekah-improved-sleep-energy-autoimmune-issues-carnivore-diet/",
      "title": "Rebekah improved autoimmune issues, sleep, gained muscle on carnivore diet",
      "date": "February 8, 2020"
    },
    {
      "visible": true,
      "uri": "https://carnivore.diet/tani-treats-insomnia-scoliosis-conjunctivitis-carnivore-diet/",
      "title": "Tani treats migraines, insomnia, scoliosis, conjunctivitis on carnivore diet",
      "date": "September 30, 2019"
    },
    {
      "visible": true,
      "uri": "https://carnivore.diet/stephen-improved-cancer-diagnosis-carnivore-diet/",
      "title": "Stephen improved his cancer diagnosis with a carnivore diet.",
      "date": "November 1, 2018"
    },
    {
      "visible": true,
      "uri": "https://carnivore.diet/nancy-treated-asthma-hashimotos-sciatica-carnivore-diet/",
      "title": "Nancy improved digestion, skeletal health, skin on carnivore diet",
      "date": "November 1, 2018"
    },
    {
      "visible": true,
      "uri": "https://carnivore.diet/jodelle-regained-period-lost-anxiety-carnivore-diet/",
      "title": "Jodelle improved hypothyroidism on carnivore diet",
      "date": "October 30, 2018"
    },
    {
      "visible": true,
      "uri": "https://carnivore.diet/robin-heals-epilepsy-seizures-joint-pain-carnivore-diet/",
      "title": "Robin heals from epilepsy, seizures, and joint pain on a carnivore diet",
      "date": "September 30, 2018"
    },
    {
      "visible": false,
      "uri": "https://carnivore.diet/elizabeth-improved-osteoporosis-on-a-carnivore-diet/",
      "title": "Elizabeth improved osteoporosis on a carnivore diet",
      "date": "February 20, 2025"
    }
  ],
  "definition": {
    "source": "https://www.mayoclinic.org/diseases-conditions/osteoporosis/symptoms-causes/syc-20351968",
    "text": "Osteoporosis causes bones to become weak and brittle \u2014 so brittle that a fall or even mild stresses such as bending over or coughing can cause a break. Osteoporosis-related breaks most commonly occur in the hip, wrist or spine."
  },
  "papers": [],
  "articles": [],
  "videos": []
}
