{
  "visible": true,
  "name": "Dental Plaque",
  "uri": "dental_plaque",
  "carnivoreDietSearchQueries": [
    "Plaque"
  ],
  "filteredAnecdotes": [
    "https://carnivore.diet/dental-health-tips-by-coach-tracy-k/",
    "https://carnivore.diet/nsvs-nonscale-victories-on-a-carnivore-diet/",
    "https://carnivore.diet/carnivore-for-alzheimers-prevention-a-no-brainer/",
    "https://carnivore.diet/cognitive-function-tips-by-coach-elizabeth-b/",
    "https://carnivore.diet/sara-manages-type-1-diabetes-on-a-low-carb-diet/",
    "https://carnivore.diet/nanci-heals-osteopenia-carnivore-diet/",
    "https://carnivore.diet/mariela-restored-health-damage-veganism/",
    "https://carnivore.diet/isaac-lost-weight-improved-health-carnivore-diet/",
    "https://carnivore.diet/danny-improved-liver-health-sleep-apnea-carnivore-diet/",
    "https://carnivore.diet/aaron-treats-auto-immune-issues-depression-carnivore-diet/",
    "https://carnivore.diet/sarah-improves-autoimmune-conditions-arthritis-carnivore-diet/",
    "https://carnivore.diet/rishi-improved-digestion-body-composition-carnivore-diet/",
    "https://carnivore.diet/alex-improved-pain-carnivore-diet/",
    "https://carnivore.diet/stephen-improved-psoriatic-arthritis-and-depression-on-the-carnivore-diet/",
    "https://carnivore.diet/stepanka-improves-depression-anorexia-and-bulimia-on-a-carnivore-diet/",
    "https://carnivore.diet/bill-healed-from-diabetes-arthritis-and-depression-on-the-carnivore-diet/",
    "https://carnivore.diet/laura-improved-anxiety-depression-skin-issues-carnivore-diet/",
    "https://carnivore.diet/todd-overcame-gout-depression-and-anxiety-on-a-carnivore-diet/",
    "https://carnivore.diet/alysha-improved-digestion-and-depression-on-the-carnivore-diet/",
    "https://carnivore.diet/mary-improved-fatigue-depression-and-anxiety-on-the-carnivore-diet/",
    "https://carnivore.diet/pim-improved-anxiety-depression-and-ibs-on-the-carnivore-diet/",
    "https://carnivore.diet/marina-manages-depression-and-weight-on-a-carnivore-diet/",
    "https://carnivore.diet/ashley-sarah-fight-depression-on-a-carnivore-diet/"
  ],
  "anecdotes": [
    {
      "visible": true,
      "uri": "https://carnivore.diet/vajid-improved-endurance-and-weight-loss-on-the-carnivore-diet/",
      "title": "Vajid improved endurance and weight loss on the carnivore diet",
      "date": "September 7, 2023"
    },
    {
      "visible": true,
      "uri": "https://carnivore.diet/katya-raw-vegan-improved-digestion-bladder-kidney-carnivore/",
      "title": "Katya improved digestion, bladder and kidney pain on a carnivore diet",
      "date": "March 21, 2020"
    },
    {
      "visible": true,
      "uri": "https://carnivore.diet/rix-improved-skin-chronic-pain-digestion-mood-carnivore-diet/",
      "title": "Mike C. improved skin, chronic pain, digestion and mood on carnivore diet",
      "date": "February 6, 2020"
    },
    {
      "visible": true,
      "uri": "https://carnivore.diet/ekaterina-ex-vegan-improved-hormonal-health-carnivore-diet/",
      "title": "Ekaterina improved digestion, hormonal health and PCOS on carnivore diet",
      "date": "December 18, 2019"
    },
    {
      "visible": true,
      "uri": "https://carnivore.diet/david-improves-weight-loss-ibs-sciatic-issues-carnivore-diet/",
      "title": "David improves IBS, dental hygiene, sciatic issues on carnivore diet",
      "date": "September 30, 2019"
    },
    {
      "visible": true,
      "uri": "https://carnivore.diet/bruce-fixes-migraines-psoriasis-carnivore-diet/",
      "title": "Bruce fixes migraines, psoriasis, environmental concerns on carnivore diet",
      "date": "October 31, 2018"
    },
    {
      "visible": true,
      "uri": "https://carnivore.diet/udo-improved-dental-health-mood-mental-health-carnivore-diet/",
      "title": "Udo lost weight and improved mental health on a carnivore diet",
      "date": "October 10, 2018"
    },
    {
      "visible": false,
      "uri": "https://carnivore.diet/stephen-improved-psoriatic-arthritis-on-the-carnivore-diet/",
      "title": "Stephen improved psoriatic arthritis and depression on the carnivore diet",
      "date": "October 19, 2024"
    }
  ],
  "definition": {
    "source": "https://my.clevelandclinic.org/health/diseases/10953-plaque",
    "text": "Dental plaque is a sticky film of bacteria that constantly forms on your teeth. It\u2019s normal to produce plaque. But if you don\u2019t remove plaque with routine dental cleanings and daily brushing and flossing, it can cause cavities, gum disease and other oral health issues."
  },
  "papers": [],
  "articles": [],
  "videos": []
}
