{
  "visible": true,
  "name": "Rectal Prolapse",
  "uri": "rectal_prolapse",
  "carnivoreDietSearchQueries": [
    "Prolapse"
  ],
  "filteredAnecdotes": [],
  "anecdotes": [
    {
      "visible": true,
      "uri": "https://carnivore.diet/jl-healed-prolapsed-pelvic-floor-digestion-carnivore-diet/",
      "title": "JL healed her prolapsed pelvic floor on a carnivore diet",
      "date": "September 12, 2020"
    },
    {
      "visible": true,
      "uri": "https://carnivore.diet/melissa-improved-pcos-endometriosis-carnivore-diet/",
      "title": "Melissa improved chronic fatigue, PCOS and endometriosis on carnivore diet",
      "date": "January 2, 2020"
    }
  ],
  "definition": {
    "source": "https://www.mayoclinic.org/diseases-conditions/rectal-prolapse/symptoms-causes/syc-20352837",
    "text": "Rectal prolapse happens when part of the large intestine's lowest section, the rectum, slips outside the muscular opening at the end of the digestive tract known as the anus. While rectal prolapse may cause pain, it's rarely a medical emergency."
  },
  "papers": [],
  "articles": [],
  "videos": []
}
